{
  "$schema": "https://json-schema.org/draft/2020-12/schema",
  "$id": "https://sessionreviewer.local/schemas/session-event-page-v1.schema.json",
  "title": "SessionReviewer event page response v1",
  "type": "object", "additionalProperties": false,
  "required": ["schema_version", "minimum_reader_version", "project_id", "provider", "session_id", "generation_id", "session_view_digest", "total", "range_start", "range_end", "items", "previous_cursor", "next_cursor", "first_cursor", "last_cursor", "coverage"],
  "properties": {
    "schema_version": { "const": 1 }, "minimum_reader_version": { "const": "0.4.0" },
    "project_id": { "$ref": "#/$defs/id" }, "provider": { "$ref": "#/$defs/id" }, "session_id": { "$ref": "#/$defs/id" }, "generation_id": { "$ref": "#/$defs/id" },
    "session_view_digest": { "$ref": "#/$defs/digest" }, "total": { "$ref": "#/$defs/nonnegative" },
    "range_start": { "$ref": "#/$defs/nonnegative" }, "range_end": { "$ref": "#/$defs/nonnegative" },
    "items": { "type": "array", "maxItems": 100, "items": { "$ref": "#/$defs/item" } },
    "previous_cursor": { "$ref": "#/$defs/cursor" }, "next_cursor": { "$ref": "#/$defs/cursor" },
    "first_cursor": { "$ref": "#/$defs/cursor" }, "last_cursor": { "$ref": "#/$defs/cursor" },
    "coverage": { "$ref": "#/$defs/coverage" }
  },
  "$defs": {
    "id": { "type": "string", "minLength": 1, "maxLength": 256, "pattern": "^[A-Za-z0-9][A-Za-z0-9._:-]*$" },
    "digest": { "type": "string", "pattern": "^sha256:[0-9a-f]{64}$" },
    "nonnegative": { "type": "integer", "minimum": 0, "maximum": 9007199254740991 },
    "cursor": { "type": ["string", "null"], "minLength": 1, "maxLength": 4096 },
    "timestamp": { "type": "string", "maxLength": 128 },
    "item": {
      "type": "object", "additionalProperties": false,
      "required": ["kind", "excerpt", "revision_id", "sequence", "occurred_at"],
      "properties": { "kind": { "enum": ["message", "tool_call", "tool_result", "cwd_change", "usage", "skip", "file_change", "command", "verification", "error", "artifact"] }, "excerpt": { "type": "string", "maxLength": 512 }, "revision_id": { "$ref": "#/$defs/id" }, "sequence": { "type": "integer", "minimum": 1, "maximum": 9007199254740991 }, "occurred_at": { "$ref": "#/$defs/timestamp" } }
    },
    "coverage": {
      "type": "object", "additionalProperties": false,
      "required": ["seen", "indexed", "collapsed", "unprojected", "undecodable", "truncated"],
      "properties": { "seen": { "$ref": "#/$defs/nonnegative" }, "indexed": { "$ref": "#/$defs/nonnegative" }, "collapsed": { "$ref": "#/$defs/nonnegative" }, "unprojected": { "$ref": "#/$defs/nonnegative" }, "undecodable": { "$ref": "#/$defs/nonnegative" }, "truncated": { "$ref": "#/$defs/nonnegative" } }
    }
  }
}
